{
  "metadata": {
    "title": "Légendaire Bûche de Noël",
    "description": "Une bûche de Noël traditionnelle avec une génoise moelleuse, une crème pâtissière aux noisettes et une crème italienne au chocolat",
    "servings": "8-10 personnes",
    "difficulty": "hard",
    "totalTime": "3h"
  },
  "ingredients": {
    "chocolat-noir": {
      "name": "Chocolat noir",
      "unit": "g",
      "category": "chocolat"
    },
    "sucre": {
      "name": "Sucre",
      "unit": "g",
      "category": "sucre"
    },
    "sucre-poudre": {
      "name": "Sucre en poudre",
      "unit": "g",
      "category": "sucre"
    },
    "beurre": {
      "name": "Beurre",
      "unit": "g",
      "category": "produit-laitier"
    },
    "oeufs": {
      "name": "Œufs",
      "unit": "unité",
      "category": "œuf"
    },
    "jaunes": {
      "name": "Jaunes d'œuf",
      "unit": "unité",
      "category": "œuf"
    },
    "farine": {
      "name": "Farine",
      "unit": "g",
      "category": "farine"
    },
    "maizena": {
      "name": "Maïzena",
      "unit": "g",
      "category": "farine"
    },
    "sel": {
      "name": "Sel",
      "unit": "pincée",
      "category": "assaisonnement"
    },
    "noisettes": {
      "name": "Noisettes",
      "unit": "poignée",
      "category": "fruit-sec"
    },
    "lait": {
      "name": "Lait",
      "unit": "cl",
      "category": "produit-laitier"
    },
    "sucre-glace": {
      "name": "Sucre glace",
      "unit": "g",
      "category": "sucre"
    }
  },
  "tools": {
    "bain-marie": {
      "name": "Bain-marie",
      "type": "cuisson"
    },
    "casserole": {
      "name": "Casserole",
      "type": "cuisson"
    },
    "saladier": {
      "name": "Saladier",
      "type": "preparation"
    },
    "fouet": {
      "name": "Fouet",
      "type": "ustensile"
    },
    "spatule": {
      "name": "Spatule",
      "type": "ustensile"
    },
    "plaque": {
      "name": "Plaque de cuisson",
      "type": "cuisson"
    },
    "papier-sulfurise": {
      "name": "Papier sulfurisé",
      "type": "preparation"
    },
    "torchon": {
      "name": "Torchon humide",
      "type": "preparation"
    },
    "poele": {
      "name": "Poêle",
      "type": "cuisson"
    },
    "couteau": {
      "name": "Couteau",
      "type": "ustensile"
    },
    "passoire": {
      "name": "Passoire",
      "type": "ustensile"
    },
    "fourchette": {
      "name": "Fourchette",
      "type": "ustensile"
    }
  },
  "subRecipes": {
    "creme-italienne": {
      "title": "Crème italienne au chocolat",
      "warning": "À faire en premier - nécessite du temps de refroidissement",
      "ingredients": {
        "jaunes": { "amount": 2 },
        "sucre": { "amount": 80 },
        "chocolat-noir": { "amount": 120 },
        "beurre": { "amount": 250 }
      },
      "steps": [
        {
          "id": "choc-1",
          "action": "Faire fondre le chocolat au bain-marie jusqu'à obtention d'une crème épaisse",
          "time": "10 min",
          "tools": ["bain-marie"],
          "inputs": [{ "type": "ingredient", "ref": "chocolat-noir" }],
          "output": {
            "state": "chocolat-fondu",
            "description": "Chocolat fondu en crème épaisse"
          }
        },
        {
          "id": "sirop-1",
          "action": "Faire cuire le sucre avec très peu d'eau jusqu'à ce que le sirop fasse le fil",
          "time": "5 min",
          "tools": ["casserole"],
          "inputs": [{ "type": "ingredient", "ref": "sucre" }],
          "output": {
            "state": "sirop-sucre",
            "description": "Sirop qui fait le fil"
          }
        },
        {
          "id": "jaunes-1",
          "action": "Mettre les jaunes dans un saladier placé dans une casserole très chaude",
          "time": "2 min",
          "tools": ["saladier", "casserole"],
          "inputs": [{ "type": "ingredient", "ref": "jaunes" }],
          "output": {
            "state": "jaunes-chauds",
            "description": "Jaunes d'œufs prêts à recevoir le sirop"
          }
        },
        {
          "id": "melange-1",
          "action": "Ajouter progressivement le sirop puis le chocolat, laisser cuire au bain-marie en remuant",
          "time": "10 min",
          "tools": ["fouet", "bain-marie"],
          "inputs": [
            { "type": "state", "ref": "jaunes-chauds" },
            { "type": "state", "ref": "sirop-sucre" },
            { "type": "state", "ref": "chocolat-fondu" }
          ],
          "output": {
            "state": "melange-cuit",
            "description": "Mélange cuit au bain-marie"
          }
        },
        {
          "id": "final-1",
          "action": "Incorporer le beurre en morceaux et travailler à froid jusqu'à épaississement",
          "time": "15 min",
          "tools": ["fouet"],
          "inputs": [
            { "type": "state", "ref": "melange-cuit" },
            { "type": "ingredient", "ref": "beurre" }
          ],
          "output": {
            "state": "creme-italienne",
            "description": "Crème italienne au chocolat épaisse"
          }
        }
      ]
    },
    "genoise": {
      "title": "Génoise",
      "ingredients": {
        "sucre-poudre": { "amount": 150 },
        "farine": { "amount": 75 },
        "maizena": { "amount": 25 },
        "oeufs": { "amount": 5 },
        "sel": { "amount": 1 }
      },
      "steps": [
        {
          "id": "sep-1",
          "action": "Séparer les blancs des jaunes d'œufs",
          "time": "2 min",
          "tools": ["saladier"],
          "inputs": [{ "type": "ingredient", "ref": "oeufs" }],
          "output": {
            "state": "oeufs-separes",
            "description": "Blancs et jaunes séparés"
          }
        },
        {
          "id": "jaunes-2",
          "action": "Battre le sucre avec les jaunes",
          "time": "5 min",
          "tools": ["fouet"],
          "inputs": [
            { "type": "state", "ref": "oeufs-separes" },
            { "type": "ingredient", "ref": "sucre-poudre" }
          ],
          "output": {
            "state": "melange-jaunes",
            "description": "Mélange jaunes et sucre"
          }
        },
        {
          "id": "farine-1",
          "action": "Tamiser ensemble la farine et la maïzena",
          "time": "2 min",
          "inputs": [
            { "type": "ingredient", "ref": "farine" },
            { "type": "ingredient", "ref": "maizena" }
          ],
          "output": {
            "state": "farine-tamisee",
            "description": "Farine et maïzena tamisées"
          }
        },
        {
          "id": "melange-2",
          "action": "Incorporer le mélange de farines aux jaunes battus avec le sucre",
          "time": "3 min",
          "tools": ["spatule"],
          "inputs": [
            { "type": "state", "ref": "melange-jaunes" },
            { "type": "state", "ref": "farine-tamisee" },
            { "type": "ingredient", "ref": "sel" }
          ],
          "output": {
            "state": "pate-base",
            "description": "Pâte de base"
          }
        },
        {
          "id": "blancs-1",
          "action": "Battre les blancs en neige très ferme",
          "time": "5 min",
          "tools": ["fouet"],
          "inputs": [{ "type": "state", "ref": "oeufs-separes" }],
          "output": {
            "state": "blancs-montes",
            "description": "Blancs montés en neige ferme"
          }
        },
        {
          "id": "melange-3",
          "action": "Incorporer délicatement les blancs à la pâte",
          "time": "3 min",
          "tools": ["spatule"],
          "inputs": [
            { "type": "state", "ref": "pate-base" },
            { "type": "state", "ref": "blancs-montes" }
          ],
          "output": {
            "state": "pate-finale",
            "description": "Pâte à génoise prête à cuire"
          }
        },
        {
          "id": "cuisson-1",
          "action": "Étaler la pâte sur une plaque recouverte de papier sulfurisé et cuire à 210°C",
          "time": "12 min",
          "tools": ["plaque", "papier-sulfurise"],
          "inputs": [{ "type": "state", "ref": "pate-finale" }],
          "output": {
            "state": "genoise-cuite",
            "description": "Génoise cuite"
          }
        },
        {
          "id": "refroid-1",
          "action": "Enrouler la génoise dans un torchon humide et laisser refroidir",
          "time": "30 min",
          "tools": ["torchon"],
          "inputs": [{ "type": "state", "ref": "genoise-cuite" }],
          "output": {
            "state": "genoise-froide",
            "description": "Génoise froide et souple"
          }
        }
      ]
    },
    "creme-patissiere": {
      "title": "Crème pâtissière aux noisettes",
      "ingredients": {
        "oeufs": { "amount": 2 },
        "farine": { "amount": 60 },
        "lait": { "amount": 40 },
        "sucre": { "amount": 80 },
        "noisettes": { "amount": 2 }
      },
      "steps": [
        {
          "id": "nois-1",
          "action": "Faire griller les noisettes puis les hacher finement",
          "time": "5 min",
          "tools": ["poele", "couteau"],
          "inputs": [{ "type": "ingredient", "ref": "noisettes" }],
          "output": {
            "state": "noisettes-grillees",
            "description": "Noisettes grillées et hachées"
          }
        },
        {
          "id": "lait-1",
          "action": "Faire bouillir le lait avec les noisettes puis filtrer",
          "time": "10 min",
          "tools": ["casserole", "passoire"],
          "inputs": [
            { "type": "ingredient", "ref": "lait" },
            { "type": "state", "ref": "noisettes-grillees" }
          ],
          "output": {
            "state": "lait-noisette",
            "description": "Lait parfumé aux noisettes"
          }
        },
        {
          "id": "app-1",